{
  "schema": "sporespore.lab.br6a_milestone_decision.v1",
  "decision_id": "BR6A_L4_VERTICAL_RAIL_LEG_SUPPORT_DECISION_V1",
  "milestone_id": "BR6A_L4_VERTICAL_RAIL_LEG_SUPPORT",
  "decision_revision": 1,
  "status": "accepted",
  "decided_by": {
    "id": "Cole",
    "authority": "project_decider",
    "decision_channel": "direct_conversation"
  },
  "authorization": {
    "instruction": "continue the pipeline. i defer to your judgement on what should be accepted. assume i accept whatever it is that you recommend and keep going",
    "interpretation": "delegated_bounded_acceptance_of_recommended_br6a_l4_vertical_rail_leg_support",
    "review_path": "docs/BR6A_L4_MILESTONE_DECISION_REVIEW.md",
    "review_commit_sha": "bb515eb680c5767bcfa00f0ffd2f09fe3d5f39d3",
    "review_sha256": "sha256:b2ac83e1f76b26c5a1226c97c776890ca1a6d12d040266de9095be0ba70ebb01"
  },
  "decided_utc": "2026-07-23T12:30:00Z",
  "evidence_basis": {
    "evidence_family": "br6a_certification_report_v1",
    "certification_id": "br6a_20260723T121533Z_c0e72549",
    "certification_contract_id": "BR6A_L4_VERTICAL_RAIL_LEG_SUPPORT",
    "campaign_id": "BR6A_L4_PROMOTION_CAMPAIGN_V1",
    "campaign_sha256": "sha256:3f79a2c2a90970286dfb3424745c29ff1a57d324079544174fa1aa88ffd0bfd6",
    "certification_claim_boundary": "This campaign can certify only the exact L4.0 rigid-strut rail oracle, L4.1 hinged-strut static load curve, and L4.3 two-link vertical-carriage support program scopes named by the source-pinned programs. The Generic6DOF vertical rail is an explicit material scaffold whose vertical axis is unlocked and whose observed reaction is retained; ordinary distal floor contact, paired finite joint torque, aggregate external-load reconstruction, crouch/rise work, the declared downward impulse, and exact infeasibility controls retain their fixture, geometry, mass, timestep, solver, controller, and actuator scopes. It establishes rail-constrained articulated vertical support only, not general per-foot allocation, free-root standing or balance, bracing, fall arrest, getting up, gait, walking, accepted knowledge, or automatic creature guidance.",
    "report_schema": "sporespore.lab.br6a_certification_report.v1",
    "report_status": "pass",
    "report_sha256": "sha256:431a98cbf727d09885378ad094efae105468c47b41c5df536b13e18c5855e42e",
    "report_bytes": 15763,
    "report_locator": "LabEvidence/BR6A/br6a_20260723T121533Z_c0e72549/br6a_certification_report.json",
    "report_generated_utc": "2026-07-23T12:17:05.3070689Z",
    "receipt_schema": "sporespore.lab.br6a_certification_report_attestation.v1",
    "receipt_sha256": "sha256:1f86dca2a62b10e7a215b9b8791692061eddb65dcdfed8c7a560f83659d4fba5",
    "receipt_locator": "LabTrust/v1/br6a_certification_reports_v1/receipts/cd5412306ffe29a0a79bc0f3114ef967883c82cd6ade958dece3f8a009215334.json",
    "receipt_attested_utc": "2026-07-23T12:17:09Z",
    "receipt_key_id": "sha256:89d6e582f28664e93d12085c164cdf8fe40a76b5bfb2e382c9666279cd953a20",
    "source_commit_sha": "c0e725496c5daf6b55bab38b1485920e1d993ff8",
    "source_inventory_sha256": "sha256:6a6d946683fd08a3f36d94e3b32d1052312b37d0d6bdb02e1ab7eb3b19933cd7",
    "source_file_count": 265,
    "br1_inventory_sha256": "sha256:f22a43c3125d2a87c3f4b154af40d5e99a2a9dd1da35e159825e79635357605e",
    "br1_inventory_unchanged": true,
    "engine_version": "4.7.stable.mono.official.5b4e0cb0f",
    "engine_sha256": "sha256:baa909d0a905021da80cfc831713e9d3ba4bd0935ac3b93ba4c77dc140cfecc4",
    "programs_required": 3,
    "programs_passed": 3,
    "replicates_per_program": 2,
    "bundles_required": 6,
    "bundles_passed": 6,
    "assertions_required": 80,
    "assertions_passed": 80,
    "milestone_programs": 3,
    "milestone_assertions": 80,
    "supplementary_programs": 0,
    "supplementary_assertions": 0,
    "integrity_programs": 0,
    "integrity_assertions": 0,
    "target_process_invocations": 6,
    "unique_target_processes": 6,
    "pid_recycle_events": 0,
    "receipts_verified": 6,
    "production_attestation_verified": true
  },
  "accepted_contracts": [
    "body_wrench_v1",
    "external_contact_impulse_reconstruction_v1",
    "vertical_load_allocator_v1",
    "force_to_joint_map_v1",
    "rail_strut_support_analysis_v1",
    "hinged_strut_rail_analysis_v1",
    "rail_leg_support_analysis_v1"
  ],
  "accepted_capabilities": [
    "The declared L4.0 rigid strut free-falls at gravity without a floor and reconstructs 29.4 N support through ordinary distal floor contact on an explicit motorless and springless vertical rail",
    "The declared L4.1 one-hinge rail strut matches the analytic static holding-torque curve at 0, 15, 30, and 45 degrees under reconstructed 29.4 N support while the matched 30-degree zero-torque control fails to hold",
    "The declared L4.3 two-link rail leg carries aggregate weight, performs the bounded crouch and rise, retains joint-work and potential-energy accounting, and recovers from the declared downward carriage impulse",
    "The declared L4.3 controller exposes its material rail reaction and refuses the exact unreachable-height and insufficient-actuator controls"
  ],
  "supplementary_constraints": [
    "The Generic6DOF vertical rail is an explicit material scaffold that locks lateral translation and all root rotation while retaining vertical translation",
    "The measured rail tangential load cannot be discarded, treated as negligible, or transferred to a free-root support claim",
    "The support result uses ordinary distal contact with no foot pin, built-in joint motor, passive tissue, or controller root-rescue force",
    "Only aggregate external load is reconstructed; no per-contact, per-foot, or per-toe allocation is available",
    "L1.8 still forbids summing same-body multi-shape predicted impulses into a foot-load measurement",
    "Every result remains bounded to the certified geometry, masses, height and load schedule, impulse, timestep, solver, controller, actuator ceiling, engine, and source"
  ],
  "claim_boundary": "BR6A accepts only the exact L4.0, L4.1, and L4.3 program claim scopes in certification br6a_20260723T121533Z_c0e72549 at source commit c0e725496c5daf6b55bab38b1485920e1d993ff8. The certification report's verbatim claim boundary, all three program scopes, and the material rail reaction remain controlling.",
  "excluded_capabilities": [
    "The omitted L4.2 free-space tracking cell",
    "A general contact wrench or continuous foot-force sensor",
    "Per-contact, per-foot, or per-toe load allocation",
    "A negligible, absent, or transferable rail reaction",
    "Free-root standing, balance, or rail-independent support",
    "Terrain robustness, morphology generality, complex-foot superiority, or endurance",
    "Bracing or fall arrest",
    "Self-righting or getting up",
    "Gait, candidate walking, or walking",
    "Accepted encyclopedia knowledge or automatic creature guidance"
  ],
  "downstream_open": [
    "Admit selected BR6A observations only through a separate append-only operation",
    "Build and certify the next support-control rung while preserving the rail as an explicit material scaffold",
    "Restore and control lateral root translation and root rotation before any free-root standing claim",
    "Establish a validated multi-contact load-allocation method before any per-foot or per-toe claim",
    "Establish contact-phase and support-force control before standing or bracing",
    "Authorize creature guidance only from separately admitted knowledge and later accepted support milestones",
    "Prove every future standing, bracing, fall-arrest, recovery, gait, and walking milestone separately"
  ],
  "knowledge_effects": {
    "entries_admitted_by_decision": 0,
    "automatic_admission": false,
    "automatic_creature_guidance_allowed": false,
    "development_drafts_remain_non_entries": true
  },
  "supersedes": []
}
